{
  "type": "dvrk_console:stereo_display@1.0.0",
  "name": "dvrk_test",
  "dvrk_console_namespace": "console",
  "sinks": [
    "side_by_side"
  ],
  "gst_input": "@dvrk:stereo_alignment:stereo",
  "eye_size": "auto",
  "pip_gst_inputs": {
    "monos": [
      {"gst_input": "videotestsrc pattern=checkers-4 is-live=true ! video/x-raw,framerate=30/1"}
    ],
    "scale": 0.3
  }
}
